{
  "schema": "drupal:node.article",
  "valid": false,
  "errors": [
    {
      "instanceLocation": "/title/0/value",
      "code": "maxLength",
      "params": {
        "limit": 255,
        "actual": 256
      }
    }
  ],
  "messages": [
    "Text value must be at most 255 characters long."
  ],
  "checks": {
    "drupal:ValidReference": {
      "errors": []
    },
    "drupal:ReferenceAccess": {
      "errors": []
    },
    "drupal:FileExtension": {
      "errors": []
    }
  }
}
