{
  "schema": "drupal:node.article",
  "valid": false,
  "errors": [
    {
      "instanceLocation": "",
      "code": "required",
      "params": {
        "property": "title"
      }
    }
  ],
  "messages": [
    "Title is required."
  ],
  "checks": {
    "drupal:ValidReference": {
      "errors": []
    },
    "drupal:ReferenceAccess": {
      "errors": []
    },
    "drupal:FileExtension": {
      "errors": []
    }
  }
}
