{
  "schema": "drupal:canvas.component.*",
  "valid": false,
  "errors": [
    {
      "instanceLocation": "/id",
      "code": "check.drupal:StringParts",
      "params": {
        "expected": "sdc.canvas_test_sdc.heading"
      }
    }
  ],
  "messages": [
    "Component is not valid."
  ],
  "checks": {
    "drupal:Callback": {
      "errors": []
    },
    "drupal:KeyForEverySdcProp": {
      "errors": []
    },
    "drupal:StringParts": {
      "errors": [
        {
          "code": "check.drupal:StringParts",
          "params": {
            "expected": "sdc.canvas_test_sdc.heading"
          }
        }
      ]
    }
  }
}
